<?xml version="1.0" encoding="utf-8"?>
<!DOCTYPE seed SYSTEM "../dtd/seed.dtd">
<seed name="medium" to-string="{name}">
    <properties>
        <varchar-property name="name" size="20"/>
    </properties>
    <values>
        <value><data>English</data></value>
        <value><data>Sinhala</data></value>
    </values>
</seed>
