<?xml version="1.0" encoding="utf-8"?>
<!DOCTYPE seed SYSTEM "../dtd/seed.dtd">
<seed name="designation" to-string="{name}">
    <properties>
        <varchar-property name="name" size="25"/>
    </properties>
    <values>
        <value><data>Teacher</data></value>
        <value><data>Principal</data></value>
        <value><data>Non-Academic</data></value>
    </values>
</seed>
