<?xml version="1.0" encoding="utf-8"?>
<!DOCTYPE seed SYSTEM "../dtd/seed.dtd">
<seed name="ethnicity" to-string="{name}">
    <properties>
        <varchar-property name="name" size="20"/>
    </properties>
    <values>
        <value><data>Sinhalese</data></value>
        <value><data>Tamil</data></value>
        <value><data>Muslim</data></value>
    </values>
</seed>
