<?xml version="1.0" encoding="utf-8"?>
<!DOCTYPE seed SYSTEM "../dtd/seed.dtd">
<seed name="bloodtype" to-string="{name}">
    <properties>
        <varchar-property name="name" size="12"/>
    </properties>
    <values>
        <value><data>A+</data></value>
        <value><data>A-</data></value>
        <value><data>B+</data></value>
        <value><data>B-</data></value>
        <value><data>C+</data></value>
        <value><data>C-</data></value>
        <value><data>O+</data></value>
        <value><data>O-</data></value>
    </values>
</seed>
