<?xml version="1.0" encoding="utf-8"?>
<!DOCTYPE seed SYSTEM "../dtd/seed.dtd">
<seed name="discounttype" to-string="{name}">
    <properties>
        <varchar-property name="name" size="20"/>
    </properties>
    <values>
        <value><data>Alumni</data></value>
        <value><data>Promotion</data></value>
        <value><data>Other</data></value>
    </values>
</seed>
